{
  "$schema": "https://json-schema.org/draft/2020-12/schema",
  "$id": "https://cios.local/schemas/flora-runtime/v0.1/relationship-projection-v0.1.schema.json",
  "title": "Relationship Projection V0.1",
  "identifier": "relationship-projection-v0.1",
  "version": "0.1.0",
  "description": "Governed relationships connected to a Focus Object.",
  "type": "object",
  "required": [
    "source_object_id",
    "target_object_id",
    "relationship_type",
    "direction",
    "authority_status",
    "resolution_status",
    "provenance"
  ],
  "properties": {
    "relationship_id": {
      "type": [
        "string",
        "null"
      ]
    },
    "source_object_id": {
      "type": "string"
    },
    "target_object_id": {
      "type": [
        "string",
        "null"
      ]
    },
    "target_original_identifier": {
      "type": [
        "string",
        "null"
      ]
    },
    "relationship_type": {
      "type": "string"
    },
    "direction": {
      "enum": [
        "outbound",
        "inbound",
        "bidirectional",
        "unknown"
      ]
    },
    "source_enterprise_id": {
      "type": [
        "string",
        "null"
      ]
    },
    "target_enterprise_id": {
      "type": [
        "string",
        "null"
      ]
    },
    "authority_status": {
      "type": "string"
    },
    "lifecycle_status": {
      "type": [
        "string",
        "null"
      ]
    },
    "effective_from": {
      "type": [
        "string",
        "null"
      ],
      "format": "date-time"
    },
    "effective_to": {
      "type": [
        "string",
        "null"
      ],
      "format": "date-time"
    },
    "provenance": {
      "type": "string"
    },
    "confidence": {
      "type": [
        "string",
        "null"
      ]
    },
    "human_supplied": {
      "type": "boolean"
    },
    "contradiction_status": {
      "enum": [
        "none_known",
        "present",
        "unknown"
      ]
    },
    "resolution_status": {
      "enum": [
        "resolved",
        "unresolved",
        "collision",
        "unclassified"
      ]
    }
  },
  "additionalProperties": false,
  "examples": [
    {
      "relationship_id": "BK-REL-001",
      "source_object_id": "EK-BANK-RHYP-001",
      "target_object_id": "EGM-001",
      "target_original_identifier": "EGM-001 \u2014 Enterprise Growth Method",
      "relationship_type": "governed_by_methodology",
      "direction": "outbound",
      "source_enterprise_id": null,
      "target_enterprise_id": null,
      "authority_status": "candidate",
      "lifecycle_status": "Candidate",
      "effective_from": null,
      "effective_to": null,
      "provenance": "enterprise-knowledge/banking/MANIFEST.yaml asset EK-BANK-RHYP-001 relationship governed_by_methodology",
      "confidence": null,
      "human_supplied": false,
      "contradiction_status": "none_known",
      "resolution_status": "resolved"
    }
  ]
}
