{"relationship_id":"BK-REL-001","source_object_id":"EK-BANK-RHYP-001","target_object_id":"EGM-001","target_original_identifier":"EGM-001 — Enterprise Growth Method","relationship_type":"governed_by_methodology","direction":"outbound","source_enterprise_id":null,"target_enterprise_id":null,"authority_status":"candidate","lifecycle_status":"Candidate","effective_from":null,"effective_to":null,"provenance":"enterprise-knowledge/banking/MANIFEST.yaml asset EK-BANK-RHYP-001 relationship governed_by_methodology","confidence":null,"human_supplied":false,"contradiction_status":"none_known","resolution_status":"resolved"}
