{"relationship_id":null,"source_object_id":"BK-FLR-SSN-SPEC-001","target_object_id":null,"target_original_identifier":"navigation persona set not separately canonicalised","relationship_type":"unclassified","direction":"outbound","source_enterprise_id":null,"target_enterprise_id":null,"authority_status":"candidate","lifecycle_status":"Candidate","effective_from":null,"effective_to":null,"provenance":"enterprise-knowledge/banking/flora/Banking-Strategic-Sales-Navigation-Specification.md representative fixture","confidence":null,"human_supplied":false,"contradiction_status":"unknown","resolution_status":"unresolved"}
